{
  "format": "test-parrot/exam",
  "formatVersion": "0.2.0",
  "name": "Unit 3 Quiz",
  "sectionHeadings": {
    "multiple-choice": {
      "title": "Choose One",
      "instructions": "Circle the best answer."
    },
    "short-answer": {
      "instructions": ""
    }
  },
  "headingSize": "large",
  "positions": [
    {
      "question": {
        "bank": "bank",
        "question": "q1"
      }
    }
  ]
}
